<?xml version="1.0" encoding="UTF-8"?>
<definition xmlns:xsi="http://www.w3.org/2001/XMLSchema-instance" xsi:noNamespaceSchemaLocation="schema.xsd">
    <type>
        <type>project</type>
        <table>PROJECTS</table>
        <properties>
            <property>
                <type>STRING</type>
                <property>string-property</property>
                <column>STRING_COLUMN</column>
                <display-property>false</display-property>
            </property>
            <property>
                <type>NUMBER</type>
                <property>number-property</property>
                <column>NUMBER_COLUMN</column>
                <display-property>false</display-property>
            </property>
            <property>
                <type>REFERENCE</type>
                <property>reference-property</property>
                <column>FOREIGN_COLUMN</column>
                <display-property>false</display-property>
                <reference>
                    <type>executor</type>
                </reference>
            </property>
        </properties>
    </type>
    <type>
        <type>executor</type>
        <table>EXECUTORS</table>
    </type>
    <type>
        <type>stage</type>
        <table>STAGES</table>
    </type>
</definition>